{
  "run_date": "2026-03-13",
  "counts": {
    "companies_processed": 1,
    "contacts_found": 1,
    "contacts_high_confidence": 1
  },
  "contacts": [
    {
      "company": "TonyBeal.net",
      "contact_name": "Tony Beal",
      "title": "CEO",
      "linkedin_url": "https://linkedin.com/in/tony-beal",
      "work_email": null,
      "confidence_score": 85,
      "priority": "p1",
      "fit_reason": "Founder and CEO of SMB, relevant title and clear domain association, strong role relevance.",
      "source": "https://www.tonybeal.net/resume.html"
    }
  ],
  "notes": {
    "blockers": [],
    "quality_flags": ["SMB_SINGLE_OPERATOR_CONTEXT", "STAGNATION_ALERT"]
  }
}
